{
  "$schema": "../.enmanner/enmanner.schema.json",
  "version": 3,
  "name": "Enmanner Vite Example",
  "identifier": "local.enmanner.vite-example",
  "icon": "enmanner/icon/EnmannerViteExample.icon",
  "userConfiguration": {
    "file": ".env",
    "template": ".env.example",
    "fields": [
      {
        "key": "VITE_GREETING",
        "label": "Greeting",
        "description": "Shown as the main heading in the example app."
      },
      {
        "key": "VITE_TEAM_API_KEY",
        "label": "Team API Key",
        "type": "secret",
        "description": "Shows whether an example team credential is configured."
      }
    ]
  },
  "application": {
    "command": [
      "npm",
      "run",
      "dev",
      "--",
      "--host",
      "127.0.0.1",
      "--port",
      "${self.endpoints.http.port}",
      "--strictPort"
    ],
    "workingDirectory": ".",
    "environment": {
      "PORT": "${self.endpoints.http.port}"
    },
    "preferredPort": 43120,
    "readiness": {
      "path": "/",
      "timeoutSeconds": 30
    }
  }
}
